{
  "schema_version": 1,
  "support_release_id": "claude-code-support-2026-08-21-candidate",
  "adapter_id": "claude-code",
  "status": "candidate",
  "artifact_compatibility": {
    "family": "claude-code",
    "platforms": [
      "darwin"
    ],
    "exact_versions": [
      "2.1.223"
    ],
    "ranges": [],
    "required_markers": [
      "active-session.version",
      "settings.schema-shape",
      "transcript.type"
    ],
    "forward_catalog_only": false
  },
  "references": {
    "ads": {
      "path": "agent-support/claude-code/candidate-2026-08-21/ads.json",
      "sha256": "sha256:d88b3e31bb3b8d7ebe7e3147a30adf774801301f164ccdfa8518545b98cb34ab"
    },
    "source_declaration": {
      "path": "agent-support/claude-code/candidate-2026-08-21/source-declarations.json",
      "sha256": "sha256:a1da27b6370c89e6d8bbc8b8fe671ab3cee4544758699729970617b29fd4ae0d"
    },
    "scope_program": {
      "path": "agent-support/claude-code/candidate-2026-08-21/scope-programs.json",
      "sha256": "sha256:b28608dcf0f0a5d6d55475b121cd4162b592c4f6a5e47e7284d3ba2b2a4434a8"
    },
    "evidence": {
      "path": "agent-support/claude-code/candidate-2026-08-21/evidence.json",
      "sha256": "sha256:29c1d6e4958bb7128b6b1d2f10604de8502eb3c5b6e402a8dc1301f1cb55e905"
    },
    "conformance": {
      "path": "agent-support/claude-code/candidate-2026-08-21/conformance.json",
      "sha256": "sha256:8d31d91b6ddbc619de9f3eaa4b8d9e63518bf4f4f4f823e075e35b265bcd8cb8"
    }
  },
  "versions": {
    "adapter_package": "0.7.0",
    "decoder_contract": 22,
    "decoder_state": [
      1
    ],
    "source_record_identity": 1,
    "fact_identity": 1,
    "external_entity_reference": 1,
    "semantic_revision_reference": 1,
    "coverage": [
      1
    ],
    "durable_contracts": {},
    "observation_contracts": {}
  },
  "capabilities": [
    {
      "capability_id": "project-session-catalog",
      "topology": "catalog",
      "level": "unsupported",
      "notes": "Catalog stays unsupported in this durable-only candidate."
    },
    {
      "capability_id": "history-and-secondary-facts",
      "topology": "durable",
      "level": "supported",
      "notes": "Durable Claude stream behavior is implemented for the exact-version candidate, but candidates are not runtime-selectable."
    },
    {
      "capability_id": "usage-v2-runtime-semantics",
      "topology": "durable",
      "level": "degraded",
      "notes": "Selected usage-v2/actor/affiliation and query-pack promote/rollback are implemented, but independent promotion, performance, and compatible-cycle review remain open."
    },
    {
      "capability_id": "root-descendant-observation",
      "topology": "scoped",
      "level": "unsupported",
      "notes": "Scoped observation stays unsupported; this durable-path candidate retains only the bounded root-transcript scope declaration."
    },
    {
      "capability_id": "interaction-lifecycle",
      "topology": "scoped",
      "level": "unsupported",
      "notes": "AskUserQuestion lifecycle stays off this product path."
    }
  ],
  "stream_contracts": [
    {
      "stream_id": "session-transcripts",
      "overlap_strategy": "full_only",
      "safe_decoder_state_boundary": "object_generation_cursor"
    },
    {
      "stream_id": "subagent-transcripts",
      "overlap_strategy": "full_only",
      "safe_decoder_state_boundary": "object_generation_cursor"
    },
    {
      "stream_id": "subagent-metadata",
      "overlap_strategy": "full_only",
      "safe_decoder_state_boundary": "object_generation_revision"
    },
    {
      "stream_id": "team-configs",
      "overlap_strategy": "full_only",
      "safe_decoder_state_boundary": "object_generation_revision"
    },
    {
      "stream_id": "team-inboxes",
      "overlap_strategy": "full_only",
      "safe_decoder_state_boundary": "object_generation_revision"
    },
    {
      "stream_id": "active-sessions",
      "overlap_strategy": "full_only",
      "safe_decoder_state_boundary": "object_generation_revision"
    },
    {
      "stream_id": "todo-snapshots",
      "overlap_strategy": "full_only",
      "safe_decoder_state_boundary": "object_generation_revision"
    },
    {
      "stream_id": "task-items",
      "overlap_strategy": "full_only",
      "safe_decoder_state_boundary": "object_generation_revision"
    },
    {
      "stream_id": "plan-documents",
      "overlap_strategy": "full_only",
      "safe_decoder_state_boundary": "object_generation_revision"
    },
    {
      "stream_id": "file-history-blobs",
      "overlap_strategy": "full_only",
      "safe_decoder_state_boundary": "object_generation_revision"
    },
    {
      "stream_id": "workflow-runs",
      "overlap_strategy": "full_only",
      "safe_decoder_state_boundary": "object_generation_revision"
    },
    {
      "stream_id": "workflow-journals",
      "overlap_strategy": "full_only",
      "safe_decoder_state_boundary": "object_generation_cursor"
    },
    {
      "stream_id": "session-indexes",
      "overlap_strategy": "full_only",
      "safe_decoder_state_boundary": "object_generation_revision"
    },
    {
      "stream_id": "project-memory-documents",
      "overlap_strategy": "full_only",
      "safe_decoder_state_boundary": "object_generation_revision"
    },
    {
      "stream_id": "persisted-tool-results",
      "overlap_strategy": "full_only",
      "safe_decoder_state_boundary": "object_generation_revision"
    },
    {
      "stream_id": "interpretation-settings",
      "overlap_strategy": "full_only",
      "safe_decoder_state_boundary": "object_generation_revision"
    }
  ],
  "reports": {
    "conformance_sha256": null,
    "performance_sha256": null
  },
  "sanitizer_review": {
    "status": "pending",
    "reviewed_at": null,
    "reviewer": null
  },
  "lifecycle": {
    "candidate_at": "2026-08-21",
    "promoted_at": null,
    "retired_at": null,
    "supersedes": null,
    "superseded_by": null
  },
  "known_limitations": [
    "Candidate entries never confer runtime support.",
    "The retained performance file is a worksheet with operation labels, not the RFC 012A benchmark-report contract.",
    "The retained telemetry file is a static classifier fixture, not evidence from a compatible release cycle.",
    "Human sanitizer review remains pending, matching sanitizer-review-inputs-v1.json.",
    "The native distributable is not retained or digest-pinned; the version marker alone is insufficient for promotion.",
    "Catalog, scoped observation, interaction lifecycle, and unselected runtime families remain unsupported."
  ],
  "drift_signatures": [
    {
      "signature_id": "bridge-session-owner-fields",
      "family_id": "session-transcript",
      "fields": [
        "ownerAccountUuid",
        "ownerOrganizationUuid"
      ],
      "state": "classified",
      "claim_refs": [
        "claude-drift-bridge-accounts"
      ]
    },
    {
      "signature_id": "active-session-name-since",
      "family_id": "active-session",
      "fields": [
        "nameSince"
      ],
      "state": "classified",
      "claim_refs": [
        "claude-drift-active-name-since"
      ]
    },
    {
      "signature_id": "settings-auto-mode",
      "family_id": "interpretation-settings",
      "fields": [
        "autoMode.environment",
        "autoMode.allow",
        "autoMode.soft_deny"
      ],
      "state": "classified",
      "claim_refs": [
        "claude-drift-auto-mode"
      ]
    }
  ],
  "promotion_blockers": [
    "Obtain independent human sanitizer review of the retained inputs.",
    "Retain the native distributable digest or amend the artifact-identification contract with reviewed evidence.",
    "Produce and review a reproducible RFC 012A performance report with measurements, environment, repetitions, and evidence digests.",
    "Run and retain the complete conformance report against this exact candidate bundle.",
    "Collect cold, warm, drift, and rollback telemetry through one compatible release cycle.",
    "Make a separate primary-integrator promotion decision after every blocker is closed."
  ]
}
